{
  "$schema": "https://json-schema.org/draft/2020-12/schema",
  "$id": "https://schemas.ecp-protocol.org/0.6.0/readiness-run.schema.json",
  "title": "ECP Readiness Run (M3-CA1 v1 manifest)",
  "description": "Run manifest for a deterministic registration-readiness assessment (M3-CA1 v1, 0.6.0). The run is a pure function of (candidates, qualification run + artifacts, decision register, population decision, set-class designation, prior population content, run metadata): readiness-verify re-derives every record and the manifest bit-identically from retained inputs. The manifest records the engine identity and profile, the input bindings (qualification run hash + chain head, decision-register hash and item states, population decision, set-class designation), the frozen 15-point check definitions, the explicit decision-rule table (precedence REJECT > REVISE > HOLD > REGISTER), the deterministic parameters (zero-executions flag, thresholds, implicit-defaults-forbidden), the population block (explicit decision, scope, prior-pool mechanical facts, cross-population overlap re-derivation), the set-class assignments, the owner-decision-register evaluation (blocking items, unresolved findings), per-case entries, the four-state tallies, the record chain head, the registration-authorization assessment (REFUSED with reasons / AUTHORIZED), the verdict, and the boundary + execution-isolation statements. run_hash = SHA-256 over the ECP-CANONICAL-JSON-1.0 serialization of this document with run_hash removed. Real run material lives only in a private readiness area; public illustrations under examples/ must be format-illustration records with real recomputable hashes.",
  "type": "object",
  "required": [
    "ecp_object",
    "run_id",
    "assessed_at",
    "operator",
    "engine",
    "inputs",
    "checks",
    "decision_rules",
    "parameters",
    "population",
    "set_classes",
    "owner_decision_register",
    "entries",
    "decisions",
    "chain_head",
    "registration_authorization",
    "verdict",
    "boundary",
    "execution_isolation",
    "determinism",
    "protocol_version",
    "schema_version",
    "run_hash"
  ],
  "properties": {
    "ecp_object": { "const": "readiness-run" },
    "content_class": {
      "enum": ["review", "format-illustration"],
      "description": "'review' = real run material (private readiness area only); 'format-illustration' = public dummy (examples/ only)."
    },
    "run_id": {
      "type": "string",
      "pattern": "^ECP-RDNYRUN-[A-Za-z0-9][A-Za-z0-9._:-]*$"
    },
    "assessed_at": { "$ref": "#/$defs/iso8601_utc" },
    "operator": { "type": "string", "minLength": 1 },
    "engine": {
      "type": "object",
      "required": ["id", "version", "profile"],
      "properties": {
        "id": { "type": "string", "minLength": 1 },
        "version": { "$ref": "#/$defs/semver" },
        "profile": { "$ref": "#/$defs/semver" }
      },
      "additionalProperties": false
    },
    "inputs": {
      "type": "object",
      "description": "Tamper-evident bindings to the preserved inputs the assessment consumed.",
      "required": [
        "qualification_run_id",
        "qualification_run_hash",
        "qualification_chain_head",
        "candidate_count",
        "decision_register",
        "population_decision",
        "set_class_designation",
        "prior_population"
      ],
      "properties": {
        "qualification_run_id": { "type": ["string", "null"] },
        "qualification_run_hash": { "$ref": "#/$defs/sha256_hex" },
        "qualification_chain_head": { "$ref": "#/$defs/sha256_hex" },
        "candidate_count": { "type": "integer", "minimum": 0 },
        "decision_register": {
          "type": "object",
          "required": ["register_id", "register_hash", "item_states"],
          "properties": {
            "register_id": { "type": ["string", "null"] },
            "register_hash": { "$ref": "#/$defs/sha256_hex" },
            "item_states": {
              "type": "object",
              "additionalProperties": { "enum": ["RESOLVED", "REMAINS-OPEN"] }
            }
          },
          "additionalProperties": false
        },
        "population_decision": {
          "type": "object",
          "required": ["decision", "rationale"],
          "properties": {
            "decision": { "enum": ["30-ONLY", "18-ONLY", "30+18", "OTHER-EXPLICIT"] },
            "rationale": { "type": "string", "minLength": 1 }
          },
          "additionalProperties": false
        },
        "set_class_designation": {
          "type": "object",
          "required": ["rationale", "set_binding_reference", "public_preexecution_forbidden"],
          "properties": {
            "rationale": { "type": "string", "minLength": 1 },
            "set_binding_reference": { "type": ["string", "null"] },
            "public_preexecution_forbidden": { "type": "boolean" }
          },
          "additionalProperties": false
        },
        "prior_population": {
          "type": "object",
          "required": ["count", "candidate_ids"],
          "properties": {
            "count": { "type": "integer", "minimum": 0 },
            "candidate_ids": { "type": "array", "items": { "type": ["string", "null"] } }
          },
          "additionalProperties": false
        }
      },
      "additionalProperties": false
    },
    "checks": {
      "type": "array",
      "description": "The frozen 15-point battery definitions (code, check, description, failure class).",
      "minItems": 15,
      "maxItems": 15,
      "items": {
        "type": "object",
        "required": ["code", "check", "description", "failure_class"],
        "properties": {
          "code": { "type": "string", "pattern": "^C-\\d{2}$" },
          "check": { "type": "string", "minLength": 1 },
          "description": { "type": "string", "minLength": 1 },
          "failure_class": { "enum": ["REJECT", "REVISE"] }
        },
        "additionalProperties": false
      }
    },
    "decision_rules": {
      "type": "object",
      "required": ["precedence", "reject", "revise", "hold", "register"],
      "properties": {
        "precedence": { "const": "REJECT > REVISE > HOLD > REGISTER" },
        "reject": { "type": "array", "items": { "type": "string", "minLength": 1 } },
        "revise": { "type": "array", "items": { "type": "string", "minLength": 1 } },
        "hold": { "type": "array", "items": { "type": "string", "minLength": 1 } },
        "register": { "type": "array", "items": { "type": "string", "minLength": 1 } }
      },
      "additionalProperties": false
    },
    "parameters": {
      "type": "object",
      "description": "Documented deterministic engine parameters.",
      "additionalProperties": true
    },
    "population": {
      "type": "object",
      "description": "The explicit population decision with mechanically re-derived facts (order §8).",
      "required": ["decision", "rationale", "scope_candidate_ids", "prior_pool_facts", "cross_population"],
      "properties": {
        "decision": { "enum": ["30-ONLY", "18-ONLY", "30+18", "OTHER-EXPLICIT"] },
        "rationale": { "type": "string", "minLength": 1 },
        "analysis_blocks": { "type": "object", "additionalProperties": true },
        "scope_candidate_ids": { "type": "array", "items": { "type": ["string", "null"] } },
        "prior_pool_facts": {
          "type": "object",
          "required": ["count", "without_formal", "without_gt_class", "without_independence"],
          "properties": {
            "count": { "type": "integer", "minimum": 0 },
            "candidate_ids": { "type": "array", "items": { "type": ["string", "null"] } },
            "protocol_versions": { "type": "array", "items": { "type": "string" } },
            "without_formal": { "type": "integer", "minimum": 0 },
            "without_gt_class": { "type": "integer", "minimum": 0 },
            "without_independence": { "type": "integer", "minimum": 0 },
            "note": { "type": "string" }
          },
          "additionalProperties": false
        },
        "cross_population": {
          "type": "object",
          "required": ["method", "threshold", "max_premise_jaccard", "max_signature_jaccard", "status"],
          "properties": {
            "method": { "type": "string", "minLength": 1 },
            "threshold": { "type": "number", "exclusiveMinimum": 0, "maximum": 1 },
            "max_premise_jaccard": { "type": "number", "minimum": 0, "maximum": 1 },
            "max_signature_jaccard": { "type": "number", "minimum": 0, "maximum": 1 },
            "max_pair": {
              "type": ["array", "null"],
              "items": { "type": ["string", "null"] }
            },
            "status": { "enum": ["CLEAR", "SUSPICION"] }
          },
          "additionalProperties": false
        }
      },
      "additionalProperties": false
    },
    "set_classes": {
      "type": "object",
      "required": ["assignments", "rationale"],
      "properties": {
        "assignments": {
          "type": "object",
          "additionalProperties": { "enum": ["PUBLIC", "PROTECTED", "HIDDEN", "ROTATING"] }
        },
        "rationale": { "type": "string", "minLength": 1 }
      },
      "additionalProperties": false
    },
    "owner_decision_register": {
      "type": "object",
      "description": "The evaluated register: item states, blocking items, unresolved findings (order §4–§6).",
      "required": ["register_id", "item_states", "blocking_items", "unresolved_findings"],
      "properties": {
        "register_id": { "type": ["string", "null"] },
        "item_states": {
          "type": "object",
          "additionalProperties": { "enum": ["RESOLVED", "REMAINS-OPEN"] }
        },
        "blocking_items": {
          "type": "array",
          "items": {
            "type": "object",
            "required": ["item_id", "reason"],
            "properties": {
              "item_id": { "type": "string", "minLength": 1 },
              "reason": { "type": "string", "minLength": 1 }
            },
            "additionalProperties": false
          }
        },
        "unresolved_findings": {
          "type": "array",
          "items": {
            "type": "object",
            "required": ["finding_id", "reason"],
            "properties": {
              "finding_id": { "type": "string", "minLength": 1 },
              "reason": { "type": "string", "minLength": 1 }
            },
            "additionalProperties": false
          }
        }
      },
      "additionalProperties": false
    },
    "entries": {
      "type": "array",
      "description": "One entry per assessed candidate, in chain order.",
      "items": {
        "type": "object",
        "required": [
          "readiness_id",
          "candidate_id",
          "content_hash",
          "decision",
          "record_hash"
        ],
        "properties": {
          "readiness_id": { "type": "string", "pattern": "^ECP-RDNY-[0-9]{6,}$" },
          "candidate_id": { "type": "string", "minLength": 1 },
          "source_case_id": { "type": ["string", "null"] },
          "content_hash": { "$ref": "#/$defs/sha256_hex" },
          "qualification_id": { "type": "string", "minLength": 1 },
          "qualification_artifact_hash": { "$ref": "#/$defs/sha256_hex" },
          "set_class": { "enum": ["PUBLIC", "PROTECTED", "HIDDEN", "ROTATING"] },
          "gt_validation_track": {
            "enum": ["CONFIRMED-TRACK", "NONDETERMINATE-READING-RULE-TRACK", "DESIGNED-AMBIGUITY-FORWARDED"]
          },
          "checks_passed": { "type": "integer", "minimum": 0, "maximum": 15 },
          "decision": { "enum": ["REGISTER", "HOLD", "REVISE", "REJECT"] },
          "record_hash": { "$ref": "#/$defs/sha256_hex" }
        },
        "additionalProperties": false
      }
    },
    "decisions": {
      "type": "object",
      "required": ["register", "hold", "revise", "reject"],
      "properties": {
        "register": { "type": "integer", "minimum": 0 },
        "hold": { "type": "integer", "minimum": 0 },
        "revise": { "type": "integer", "minimum": 0 },
        "reject": { "type": "integer", "minimum": 0 }
      },
      "additionalProperties": false
    },
    "chain_head": {
      "$ref": "#/$defs/sha256_hex",
      "description": "Hash of the last readiness record (genesis '0'*64 for an empty run)."
    },
    "registration_authorization": {
      "type": "object",
      "description": "The order §11/§12 gate: AUTHORIZED only when nothing blocks; REFUSED carries every reason.",
      "required": ["status", "reasons"],
      "properties": {
        "status": { "enum": ["AUTHORIZED", "REFUSED"] },
        "reasons": { "type": "array", "items": { "type": "string", "minLength": 1 } }
      },
      "additionalProperties": false
    },
    "verdict": { "enum": ["OWNER-DECISION-REQUIRED", "REGISTRATION-AUTHORIZED"] },
    "boundary": {
      "enum": [
        "REGISTRATION REMAINS CLOSED — READINESS ASSESSMENT ONLY; the manifest gate REFUSES while unresolved blocking owner items exist (order §11/§12)",
        "REGISTRATION AUTHORIZED AT SET LEVEL — manifest construction permitted under this order; the ledger ceremony remains the separate full-contract instrument"
      ]
    },
    "execution_isolation": {
      "const": "NO evaluated model execution; NO case execution; NO results collection; NO scoring; NO statistical testing; NO ledger writes (order §12)"
    },
    "determinism": {
      "type": "string",
      "minLength": 1,
      "description": "Statement of the pure-function inputs the run depends on."
    },
    "protocol_version": { "$ref": "#/$defs/semver" },
    "schema_version": { "$ref": "#/$defs/semver" },
    "run_hash": {
      "$ref": "#/$defs/sha256_hex",
      "description": "SHA-256 over ECP-CANONICAL-JSON-1.0 of this document with run_hash removed."
    }
  },
  "additionalProperties": false,
  "$defs": {
    "semver": {
      "type": "string",
      "pattern": "^(0|[1-9]\\d*)\\.(0|[1-9]\\d*)\\.(0|[1-9]\\d*)(?:-((?:0|[1-9]\\d*|\\d*[a-zA-Z-][0-9a-zA-Z-]*)(?:\\.(?:0|[1-9]\\d*|\\d*[a-zA-Z-][0-9a-zA-Z-]*))*))?(?:\\+([0-9a-zA-Z-]+(?:\\.[0-9a-zA-Z-]+)*))?$"
    },
    "sha256_hex": {
      "type": "string",
      "pattern": "^[0-9a-f]{64}$"
    },
    "iso8601_utc": {
      "type": "string",
      "pattern": "^\\d{4}-\\d{2}-\\d{2}T\\d{2}:\\d{2}:\\d{2}(\\.\\d+)?Z$"
    }
  }
}
