{"assessed_at":"2026-09-09T00:00:00Z","boundary":"REGISTRATION REMAINS CLOSED — READINESS ASSESSMENT ONLY; the manifest gate REFUSES while unresolved blocking owner items exist (order §11/§12)","chain_head":"29b42cd5543844a825c7c75d7936c21656f466d19e0194018a6ef115bdb31ad7","checks":[{"check":"candidate-contract","code":"C-01","description":"candidate cites the case-candidate contract with accepted versions","failure_class":"REJECT"},{"check":"qualification-decision","code":"C-02","description":"qualification artifact contract valid and decision ACCEPT (recorded findings carried)","failure_class":"REJECT"},{"check":"content-hash-binding","code":"C-03","description":"candidate == artifact == run entry content-hash identity","failure_class":"REJECT"},{"check":"provenance-completeness","code":"C-04","description":"section-3 authoring-independence record complete (13 fields)","failure_class":"REVISE"},{"check":"independence-explicitness","code":"C-05","description":"explicit non-bare independence status with declared limitations","failure_class":"REVISE"},{"check":"ground-truth-mechanical","code":"C-06","description":"Q3 mechanical ground-truth verification PASS","failure_class":"REJECT"},{"check":"ground-truth-class-consistency","code":"C-07","description":"authored ground-truth class equals mechanically derived class","failure_class":"REJECT"},{"check":"artifact-chain-integrity","code":"C-08","description":"qualification artifact hash recomputes and chain link holds","failure_class":"REJECT"},{"check":"novelty-within-pool","code":"C-09","description":"N3 renaming-invariant structural skeleton UNIQUE in pool","failure_class":"REJECT"},{"check":"novelty-cross-population","code":"C-10","description":"N4 cross-population overlap CLEAR against the prior pool","failure_class":"REJECT"},{"check":"novelty-implementation-encoding","code":"C-11","description":"N5 implementation-encoding CLEAR","failure_class":"REJECT"},{"check":"novelty-fixture-leakage","code":"C-12","description":"N6 fixture-leakage CLEAR","failure_class":"REJECT"},{"check":"leakage-pre-screen","code":"C-13","description":"six-class leakage pre-screen CLEAR (model class N.A. pre-execution)","failure_class":"REJECT"},{"check":"disclosure-representation-bias","code":"C-14","description":"section-9 representation-bias disclosure present (record + dimension)","failure_class":"REVISE"},{"check":"disclosure-environmental-precheck","code":"C-15","description":"section-10 environmental pre-check present (record + dimension)","failure_class":"REVISE"}],"content_class":"format-illustration","decision_rules":{"hold":["all 15 checks pass but an unresolved blocking owner item binds the case"],"precedence":"REJECT > REVISE > HOLD > REGISTER","register":["all 15 checks pass; no blocking item; valid set class; inside the scope"],"reject":["any reject-class check of the 15-point battery fails"],"revise":["a revise-class check fails (provenance/disclosure completeness)"]},"decisions":{"hold":1,"register":0,"reject":0,"revise":0},"determinism":"FORMAT ILLUSTRATION (public dummy values; real readiness material lives only in a private readiness area); pure function of (candidates, qualification run + artifacts, decision register, population decision, set-class designation, prior population content, run metadata)","ecp_object":"readiness-run","engine":{"id":"ECP-READINESS-ENGINE-1","profile":"0.6.0","version":"0.6.0"},"entries":[{"candidate_id":"ECP-CAND-000001","checks_passed":15,"content_hash":"d93ee1810e1a63a07e6a6446b988e5289a85beda959b83b589a9b0cf918d0004","decision":"HOLD","gt_validation_track":"CONFIRMED-TRACK","qualification_artifact_hash":"21df33d5afc2fac8f66a3aa9d8834953f10441bdf96ca157663a3d8968863ed9","qualification_id":"ECP-QUAL-900001","readiness_id":"ECP-RDNY-900101","record_hash":"29b42cd5543844a825c7c75d7936c21656f466d19e0194018a6ef115bdb31ad7","set_class":"PROTECTED","source_case_id":"S-001"}],"execution_isolation":"NO evaluated model execution; NO case execution; NO results collection; NO scoring; NO statistical testing; NO ledger writes (order §12)","inputs":{"candidate_count":1,"decision_register":{"item_states":{"O-01":"REMAINS-OPEN","O-02":"REMAINS-OPEN","O-03":"REMAINS-OPEN","O-04":"REMAINS-OPEN"},"register_hash":"0d8d991eb815747a2470ca8e1112dee85e274fa060e2d92b1cd8992b186efa91","register_id":"ECP-OWNDEC-900002"},"population_decision":{"decision":"30-ONLY","rationale":"illustration population rationale"},"prior_population":{"candidate_ids":[],"count":0},"qualification_chain_head":"21df33d5afc2fac8f66a3aa9d8834953f10441bdf96ca157663a3d8968863ed9","qualification_run_hash":"11f383c37cb07649ab685c23b59e5a24324b04209804082f9a5e838a5b18e2eb","qualification_run_id":"ECP-QUALRUN-EXAMPLE","set_class_designation":{"public_preexecution_forbidden":true,"rationale":"illustration set-class rationale","set_binding_reference":null}},"operator":"ECP Foundation Executor <foundation@ecp-protocol.local>","owner_decision_register":{"blocking_items":[{"item_id":"O-01","reason":"illustration: unresolved and blocking"},{"item_id":"O-02","reason":"illustration: unresolved and blocking"},{"item_id":"O-04","reason":"illustration: unresolved and blocking"}],"item_states":{"O-01":"REMAINS-OPEN","O-02":"REMAINS-OPEN","O-03":"REMAINS-OPEN","O-04":"REMAINS-OPEN"},"register_id":"ECP-OWNDEC-900002","unresolved_findings":[]},"parameters":{"cross_population_jaccard_threshold":0.5,"implicit_defaults":"FORBIDDEN (order §4): every owner item carries an explicit state","zero_executions_project_wide":true},"population":{"cross_population":{"max_pair":null,"max_premise_jaccard":0.0,"max_signature_jaccard":0.0,"method":"text-normalized premise/signature Jaccard vs the prior format-1 pool (N4 basis, re-derived)","status":"CLEAR","threshold":0.5},"decision":"30-ONLY","prior_pool_facts":{"candidate_ids":[],"count":0,"note":"illustration: no prior pool supplied","protocol_versions":[],"without_formal":0,"without_gt_class":0,"without_independence":0},"rationale":"illustration population rationale","scope_candidate_ids":["ECP-CAND-000001"]},"protocol_version":"0.6.0","registration_authorization":{"reasons":["O-01 REMAINS-OPEN and blocking (illustration)","O-02 REMAINS-OPEN and blocking (illustration)","O-04 REMAINS-OPEN and blocking (illustration)","ECP-CAND-000001: readiness decision HOLD (illustration)"],"status":"REFUSED"},"run_hash":"a880fe8ea257601a97a8f9d0abf276d45a761b7ba1afd93cdd51231321b66272","run_id":"ECP-RDNYRUN-EXAMPLE","schema_version":"0.6.0","set_classes":{"assignments":{"ECP-CAND-000001":"PROTECTED"},"rationale":"illustration set-class rationale"},"verdict":"OWNER-DECISION-REQUIRED"}